# "No.","Time","Source","Destination","Protocol","Length","Info"
"1","0.000000","10.0.0.3","23.53.40.192","TCP","54","57433 → 443 [FIN, ACK] Seq=1 Ack=1 Win=1024 Len=0"
"2","0.471119","10.0.0.3","51.104.15.253","TCP","66","59038 → 443 [SYN] Seq=0 Win=64240 Len=0 MSS=1460 WS=256 SACK_PERM=1"
"3","0.737249","51.104.15.253","10.0.0.3","TCP","66","443 → 59038 [SYN, ACK] Seq=0 Ack=1 Win=65535 Len=0 MSS=1440 WS=256 SACK_PERM=1"
"4","0.737328","10.0.0.3","51.104.15.253","TCP","54","59038 → 443 [ACK] Seq=1 Ack=1 Win=263424 Len=0"
"5","0.737657","10.0.0.3","51.104.15.253","TLSv1.2","571","Client Hello"
"6","1.005092","51.104.15.253","10.0.0.3","TLSv1.2","147","[TCP Previous segment not captured] , Ignored Unknown Record"
"7","1.005092","51.104.15.253","10.0.0.3","TCP","1506","[TCP Out-Of-Order] 443 → 59038 [ACK] Seq=1 Ack=518 Win=525056 Len=1452"
"8","1.005092","51.104.15.253","10.0.0.3","TCP","1506","[TCP Out-Of-Order] 443 → 59038 [ACK] Seq=1453 Ack=518 Win=525056 Len=1452"
"9","1.005092","51.104.15.253","10.0.0.3","TCP","1506","[TCP Out-Of-Order] 443 → 59038 [ACK] Seq=2905 Ack=518 Win=525056 Len=1452"
"10","1.005141","10.0.0.3","51.104.15.253","TCP","66","[TCP Dup ACK 4#1] 59038 → 443 [ACK] Seq=518 Ack=1 Win=263424 Len=0 SLE=4357 SRE=4450"
"11","1.005184","10.0.0.3","51.104.15.253","TCP","54","59038 → 443 [ACK] Seq=518 Ack=4450 Win=263424 Len=0"
"12","1.006543","10.0.0.3","51.104.15.253","TLSv1.2","212","Client Key Exchange, Change Cipher Spec, Encrypted Handshake Message"
"13","1.122186","10.0.0.3","51.104.15.253","TCP","66","59039 → 443 [SYN] Seq=0 Win=64240 Len=0 MSS=1460 WS=256 SACK_PERM=1"
"14","1.273619","51.104.15.253","10.0.0.3","TLSv1.2","105","Change Cipher Spec, Encrypted Handshake Message"
"15","1.274243","10.0.0.3","51.104.15.253","TLSv1.2","861","Application Data"
"16","1.387304","51.104.15.253","10.0.0.3","TCP","66","443 → 59039 [SYN, ACK] Seq=0 Ack=1 Win=65535 Len=0 MSS=1440 WS=256 SACK_PERM=1"
"17","1.387390","10.0.0.3","51.104.15.253","TCP","54","59039 → 443 [ACK] Seq=1 Ack=1 Win=263424 Len=0"
"18","1.387825","10.0.0.3","51.104.15.253","TLSv1.2","571","Client Hello"
"19","1.431078","10.0.0.3","224.0.0.251","IGMPv2","46","Membership Report group 224.0.0.251"
"20","1.593125","51.104.15.253","10.0.0.3","TCP","60","443 → 59038 [ACK] Seq=4501 Ack=1483 Win=525568 Len=0"
"21","1.653566","51.104.15.253","10.0.0.3","TCP","1506","443 → 59039 [ACK] Seq=1 Ack=518 Win=525056 Len=1452 [TCP segment of a reassembled PDU]"
"22","1.653566","51.104.15.253","10.0.0.3","TCP","1506","443 → 59039 [ACK] Seq=1453 Ack=518 Win=525056 Len=1452 [TCP segment of a reassembled PDU]"
"23","1.653566","51.104.15.253","10.0.0.3","TCP","147","[TCP Previous segment not captured] 443 → 59039 [PSH, ACK] Seq=4357 Ack=518 Win=525056 Len=93 [TCP segment of a reassembled PDU]"
"24","1.653566","51.104.15.253","10.0.0.3","TCP","1506","[TCP Out-Of-Order] 443 → 59039 [ACK] Seq=2905 Ack=518 Win=525056 Len=1452"
"25","1.653651","10.0.0.3","51.104.15.253","TCP","66","59039 → 443 [ACK] Seq=518 Ack=2905 Win=263424 Len=0 SLE=4357 SRE=4450"
"26","1.653666","10.0.0.3","51.104.15.253","TCP","54","59039 → 443 [ACK] Seq=518 Ack=4450 Win=263424 Len=0"
"27","1.655148","10.0.0.3","51.104.15.253","TLSv1.2","212","Client Key Exchange, Change Cipher Spec, Encrypted Handshake Message"
"28","1.920452","51.104.15.253","10.0.0.3","TLSv1.2","105","Change Cipher Spec, Encrypted Handshake Message"
"29","1.923303","10.0.0.3","51.104.15.253","TLSv1.2","1939","Application Data"
"30","2.188029","51.104.15.253","10.0.0.3","TCP","66","[TCP Dup ACK 28#1] 443 → 59039 [ACK] Seq=4501 Ack=676 Win=524800 Len=0 SLE=2116 SRE=2561"
"31","2.188029","51.104.15.253","10.0.0.3","TCP","60","443 → 59039 [ACK] Seq=4501 Ack=2561 Win=525568 Len=0"
"32","2.312674","10.0.0.3","117.18.232.200","TCP","54","58841 → 443 [FIN, ACK] Seq=1 Ack=1 Win=1023 Len=0"
"33","2.378541","51.104.15.253","10.0.0.3","TLSv1.2","486","Application Data"
"34","2.378541","51.104.15.253","10.0.0.3","TCP","486","[TCP Out-Of-Order] 443 → 59038 [FIN, PSH, ACK] Seq=4501 Ack=1483 Win=525568 Len=432"
"35","2.378684","10.0.0.3","51.104.15.253","TCP","66","59038 → 443 [ACK] Seq=1483 Ack=4934 Win=262912 Len=0 SLE=4501 SRE=4933"
"36","2.380160","10.0.0.3","51.104.15.253","TLSv1.2","85","Encrypted Alert"
"37","2.380426","10.0.0.3","51.104.15.253","TCP","54","59038 → 443 [FIN, ACK] Seq=1514 Ack=4934 Win=262912 Len=0"
"38","2.437158","10.0.0.3","224.0.0.252","IGMPv2","46","Membership Report group 224.0.0.252"
"39","2.437310","10.0.0.3","239.255.255.250","IGMPv2","46","Membership Report group 239.255.255.250"
"40","2.584946","51.104.15.253","10.0.0.3","TLSv1.2","486","Application Data"
"41","2.585026","10.0.0.3","51.104.15.253","TCP","54","59039 → 443 [ACK] Seq=2561 Ack=4934 Win=262912 Len=0"
"42","2.585054","51.104.15.253","10.0.0.3","TCP","486","[TCP Spurious Retransmission] 443 → 59039 [FIN, PSH, ACK] Seq=4501 Ack=2561 Win=525568 Len=432"
"43","2.585076","10.0.0.3","51.104.15.253","TCP","66","[TCP Dup ACK 41#1] 59039 → 443 [ACK] Seq=2561 Ack=4934 Win=262912 Len=0 SLE=4501 SRE=4933"
"44","2.585584","10.0.0.3","51.104.15.253","TLSv1.2","85","Encrypted Alert"
"45","2.586020","10.0.0.3","51.104.15.253","TCP","54","59039 → 443 [FIN, ACK] Seq=2592 Ack=4934 Win=262912 Len=0"
"46","2.646512","51.104.15.253","10.0.0.3","TCP","60","443 → 59038 [ACK] Seq=4934 Ack=1515 Win=525568 Len=0"
"47","2.850564","51.104.15.253","10.0.0.3","TCP","60","443 → 59039 [ACK] Seq=4934 Ack=2593 Win=525568 Len=0"
"48","3.140248","10.0.0.3","10.0.0.1","DNS","85","Standard query 0x749e A vortex.data.microsoft.com"
"49","3.177938","10.0.0.1","10.0.0.3","DNS","152","Standard query response 0x749e A vortex.data.microsoft.com CNAME asimov.vortex.data.trafficmanager.net A 23.96.225.71"
"50","3.179321","10.0.0.3","23.96.225.71","TCP","66","59041 → 443 [SYN] Seq=0 Win=64240 Len=0 MSS=1460 WS=256 SACK_PERM=1"
"51","3.425067","23.96.225.71","10.0.0.3","TCP","66","443 → 59041 [SYN, ACK] Seq=0 Ack=1 Win=65535 Len=0 MSS=1440 WS=256 SACK_PERM=1"
"52","3.425198","10.0.0.3","23.96.225.71","TCP","54","59041 → 443 [ACK] Seq=1 Ack=1 Win=263424 Len=0"
"53","3.425873","10.0.0.3","23.96.225.71","TLSv1.2","571","Client Hello"
"54","3.585394","10.0.0.3","239.100.1.1","ICEP","401","Request(oneway): stateReceiver.receiveStationRunningState()"
"55","3.585437","10.0.0.3","239.100.1.1","ICEP","108","Request(oneway): stateReceiver.receiveAppRunningState()"
"56","3.618594","10.0.0.3","239.100.1.1","ICEP","356","Request(oneway): stateReceiver.receiveNetStatistics()"
"57","3.672662","23.96.225.71","10.0.0.3","TCP","1506","443 → 59041 [ACK] Seq=1 Ack=518 Win=525056 Len=1452 [TCP segment of a reassembled PDU]"
"58","3.672662","23.96.225.71","10.0.0.3","TCP","1506","443 → 59041 [ACK] Seq=1453 Ack=518 Win=525056 Len=1452 [TCP segment of a reassembled PDU]"
"59","3.672662","23.96.225.71","10.0.0.3","TLSv1.2","1041","Server Hello, Certificate, Server Key Exchange, Server Hello Done"
"60","3.672730","10.0.0.3","23.96.225.71","TCP","54","59041 → 443 [ACK] Seq=518 Ack=3892 Win=263424 Len=0"
"61","3.673235","10.0.0.3","23.96.225.71","TLSv1.2","147","Client Key Exchange, Change Cipher Spec, Encrypted Handshake Message"
"62","3.917853","23.96.225.71","10.0.0.3","TLSv1.2","105","Change Cipher Spec, Encrypted Handshake Message"
"63","3.918403","10.0.0.3","23.96.225.71","TLSv1.2","865","Application Data"
"64","4.169973","10.0.0.3","23.53.40.192","TCP","54","[TCP Retransmission] 57433 → 443 [FIN, ACK] Seq=1 Ack=1 Win=1024 Len=0"
"65","4.217741","23.96.225.71","10.0.0.3","TCP","60","443 → 59041 [ACK] Seq=3943 Ack=1422 Win=524032 Len=0"
"66","4.242983","23.96.225.71","10.0.0.3","TLSv1.2","368","Application Data"
"67","4.242983","23.96.225.71","10.0.0.3","TCP","368","[TCP Out-Of-Order] 443 → 59041 [FIN, PSH, ACK] Seq=3943 Ack=1422 Win=524032 Len=314"
"68","4.243057","10.0.0.3","23.96.225.71","TCP","66","59041 → 443 [ACK] Seq=1422 Ack=4258 Win=262912 Len=0 SLE=3943 SRE=4257"
"69","4.243321","10.0.0.3","23.96.225.71","TLSv1.2","85","Encrypted Alert"
"70","4.243409","10.0.0.3","23.96.225.71","TCP","54","59041 → 443 [FIN, ACK] Seq=1453 Ack=4258 Win=262912 Len=0"
"71","4.487454","23.96.225.71","10.0.0.3","TCP","60","443 → 59041 [ACK] Seq=4258 Ack=1454 Win=525568 Len=0"
"72","5.322114","10.0.0.3","23.215.100.64","TLSv1.2","266","Client Hello"
"73","6.392994","13.225.141.19","10.0.0.3","TLSv1.2","93","Application Data"
"74","6.392994","13.225.141.19","10.0.0.3","TLSv1.2","78","Application Data"
"75","6.393137","10.0.0.3","13.225.141.19","TCP","54","58892 → 443 [ACK] Seq=1 Ack=64 Win=1027 Len=0"
"76","7.243530","13.225.141.19","10.0.0.3","TCP","60","443 → 58892 [FIN, ACK] Seq=64 Ack=1 Win=131 Len=0"
"77","7.243582","10.0.0.3","13.225.141.19","TCP","54","58892 → 443 [ACK] Seq=1 Ack=65 Win=1027 Len=0"
"78","7.243615","13.225.141.19","10.0.0.3","TCP","60","[TCP Out-Of-Order] 443 → 58892 [FIN, ACK] Seq=64 Ack=1 Win=131 Len=0"
"79","7.243626","10.0.0.3","13.225.141.19","TCP","54","[TCP Dup ACK 77#1] 58892 → 443 [ACK] Seq=1 Ack=65 Win=1027 Len=0"
"80","7.373278","10.0.0.3","104.17.24.14","TCP","55","58906 → 443 [ACK] Seq=1 Ack=1 Win=1028 Len=1 [TCP segment of a reassembled PDU]"
"81","7.571466","104.17.24.14","10.0.0.3","TCP","66","443 → 58906 [ACK] Seq=1 Ack=2 Win=64 Len=0 SLE=1 SRE=2"
"82","8.695326","10.0.0.3","239.100.1.1","ICEP","401","Request(oneway): stateReceiver.receiveStationRunningState()"
"83","8.695353","10.0.0.3","239.100.1.1","ICEP","108","Request(oneway): stateReceiver.receiveAppRunningState()"
"84","8.718602","10.0.0.3","239.100.1.1","ICEP","356","Request(oneway): stateReceiver.receiveNetStatistics()"
"85","10.936356","10.0.0.3","52.139.250.253","TLSv1.2","98","Application Data"
"86","11.044768","52.139.250.253","10.0.0.3","TLSv1.2","229","Application Data"
"87","11.095639","10.0.0.3","52.139.250.253","TCP","54","55677 → 443 [ACK] Seq=45 Ack=176 Win=1023 Len=0"
"88","11.905653","10.0.0.3","117.18.232.200","TCP","54","[TCP Retransmission] 58841 → 443 [FIN, ACK] Seq=1 Ack=1 Win=1023 Len=0"
"89","11.934958","BaiduOnl_fd:9e:c4","Broadcast","ARP","60","Who has 10.0.0.2? Tell 10.0.0.4"
"90","11.936952","BaiduOnl_fd:9e:c4","Broadcast","ARP","60","Who has 10.0.0.3? Tell 10.0.0.4"
"91","11.936959","Giga-Byt_01:fc:42","BaiduOnl_fd:9e:c4","ARP","42","10.0.0.3 is at 1c:1b:0d:01:fc:42"
"92","11.938548","BaiduOnl_fd:9e:c4","Broadcast","ARP","60","Who has 10.0.0.5? Tell 10.0.0.4"
"93","11.938926","BaiduOnl_fd:9e:c4","Broadcast","ARP","60","Who has 10.0.0.6? Tell 10.0.0.4"
"94","11.938971","10.0.0.4","10.0.0.3","ICMP","74","Echo (ping) request  id=0xafaf, seq=0/0, ttl=255 (reply in 95)"
"95","11.939001","10.0.0.3","10.0.0.4","ICMP","74","Echo (ping) reply    id=0xafaf, seq=0/0, ttl=128 (request in 94)"
"96","11.942312","BaiduOnl_fd:9e:c4","Broadcast","ARP","60","Who has 10.0.0.7? Tell 10.0.0.4"
"97","11.942611","BaiduOnl_fd:9e:c4","Broadcast","ARP","60","Who has 10.0.0.8? Tell 10.0.0.4"
"98","11.943661","BaiduOnl_fd:9e:c4","Broadcast","ARP","60","Who has 10.0.0.9? Tell 10.0.0.4"
"99","11.944808","BaiduOnl_fd:9e:c4","Broadcast","ARP","60","Who has 10.0.0.10? Tell 10.0.0.4"
"100","11.945963","BaiduOnl_fd:9e:c4","Broadcast","ARP","60","Who has 10.0.0.11? Tell 10.0.0.4"
"101","11.948018","BaiduOnl_fd:9e:c4","Broadcast","ARP","60","Who has 10.0.0.12? Tell 10.0.0.4"
"102","12.505219","10.0.0.3","23.53.40.192","TCP","54","[TCP Retransmission] 57433 → 443 [FIN, ACK] Seq=1 Ack=1 Win=1024 Len=0"
"103","12.799374","BaiduOnl_fd:9e:c4","Broadcast","ARP","60","Who has 10.0.0.12? Tell 10.0.0.4"
"104","12.799374","BaiduOnl_fd:9e:c4","Broadcast","ARP","60","Who has 10.0.0.2? Tell 10.0.0.4"
"105","12.800577","BaiduOnl_fd:9e:c4","Broadcast","ARP","60","Who has 10.0.0.5? Tell 10.0.0.4"
"106","12.801569","BaiduOnl_fd:9e:c4","Broadcast","ARP","60","Who has 10.0.0.6? Tell 10.0.0.4"
"107","12.801680","BaiduOnl_fd:9e:c4","Broadcast","ARP","60","Who has 10.0.0.7? Tell 10.0.0.4"
"108","12.801821","BaiduOnl_fd:9e:c4","Broadcast","ARP","60","Who has 10.0.0.8? Tell 10.0.0.4"
"109","12.802043","BaiduOnl_fd:9e:c4","Broadcast","ARP","60","Who has 10.0.0.9? Tell 10.0.0.4"
"110","12.803468","BaiduOnl_fd:9e:c4","Broadcast","ARP","60","Who has 10.0.0.10? Tell 10.0.0.4"
"111","12.803468","BaiduOnl_fd:9e:c4","Broadcast","ARP","60","Who has 10.0.0.11? Tell 10.0.0.4"
"112","13.205152","13.225.141.19","10.0.0.3","TLSv1.2","93","Application Data"
"113","13.205152","13.225.141.19","10.0.0.3","TLSv1.2","78","Application Data"
"114","13.205152","13.225.141.19","10.0.0.3","TCP","60","443 → 58894 [FIN, ACK] Seq=64 Ack=1 Win=133 Len=0"
"115","13.205299","10.0.0.3","13.225.141.19","TCP","54","58894 → 443 [ACK] Seq=1 Ack=65 Win=1024 Len=0"
"116","13.205779","10.0.0.3","13.225.141.19","TCP","54","58894 → 443 [FIN, ACK] Seq=1 Ack=65 Win=1024 Len=0"
"117","13.397671","13.225.141.19","10.0.0.3","TCP","60","443 → 58894 [ACK] Seq=65 Ack=2 Win=133 Len=0"
"118","13.596112","10.0.0.3","203.208.50.73","TCP","55","58905 → 443 [ACK] Seq=1 Ack=1 Win=1026 Len=1 [TCP segment of a reassembled PDU]"
"119","13.612101","10.0.0.3","172.67.193.35","TCP","55","58901 → 443 [ACK] Seq=1 Ack=1 Win=1023 Len=1 [TCP segment of a reassembled PDU]"
"120","13.634587","203.208.50.73","10.0.0.3","TCP","66","443 → 58905 [ACK] Seq=1 Ack=2 Win=266 Len=0 SLE=1 SRE=2"
"121","13.800250","BaiduOnl_fd:9e:c4","Broadcast","ARP","60","Who has 10.0.0.12? Tell 10.0.0.4"
"122","13.800795","10.0.0.3","239.100.1.1","ICEP","401","Request(oneway): stateReceiver.receiveStationRunningState()"
"123","13.800826","10.0.0.3","239.100.1.1","ICEP","108","Request(oneway): stateReceiver.receiveAppRunningState()"
"124","13.801286","BaiduOnl_fd:9e:c4","Broadcast","ARP","60","Who has 10.0.0.2? Tell 10.0.0.4"
"125","13.802535","BaiduOnl_fd:9e:c4","Broadcast","ARP","60","Who has 10.0.0.5? Tell 10.0.0.4"
"126","13.802677","BaiduOnl_fd:9e:c4","Broadcast","ARP","60","Who has 10.0.0.6? Tell 10.0.0.4"
"127","13.802831","BaiduOnl_fd:9e:c4","Broadcast","ARP","60","Who has 10.0.0.7? Tell 10.0.0.4"
"128","13.803049","BaiduOnl_fd:9e:c4","Broadcast","ARP","60","Who has 10.0.0.8? Tell 10.0.0.4"
"129","13.804067","BaiduOnl_fd:9e:c4","Broadcast","ARP","60","Who has 10.0.0.9? Tell 10.0.0.4"
"130","13.804229","BaiduOnl_fd:9e:c4","Broadcast","ARP","60","Who has 10.0.0.10? Tell 10.0.0.4"
"131","13.804363","BaiduOnl_fd:9e:c4","Broadcast","ARP","60","Who has 10.0.0.11? Tell 10.0.0.4"
"132","13.819639","172.67.193.35","10.0.0.3","TCP","66","443 → 58901 [ACK] Seq=1 Ack=2 Win=66 Len=0 SLE=1 SRE=2"
"133","13.845711","10.0.0.3","203.208.43.97","TCP","55","58866 → 443 [ACK] Seq=1 Ack=1 Win=1024 Len=1 [TCP segment of a reassembled PDU]"
"134","13.854482","10.0.0.3","239.100.1.1","ICEP","356","Request(oneway): stateReceiver.receiveNetStatistics()"
"135","13.881715","203.208.43.97","10.0.0.3","TCP","66","443 → 58866 [ACK] Seq=1 Ack=2 Win=290 Len=0 SLE=1 SRE=2"
"136","13.954245","10.0.0.3","203.208.43.70","TCP","55","58867 → 443 [ACK] Seq=1 Ack=1 Win=1026 Len=1 [TCP segment of a reassembled PDU]"
"137","13.991329","203.208.43.70","10.0.0.3","TCP","66","443 → 58867 [ACK] Seq=1 Ack=2 Win=271 Len=0 SLE=1 SRE=2"
"138","14.801428","BaiduOnl_fd:9e:c4","Broadcast","ARP","60","Who has 10.0.0.12? Tell 10.0.0.4"
"139","14.802500","BaiduOnl_fd:9e:c4","Broadcast","ARP","60","Who has 10.0.0.2? Tell 10.0.0.4"
"140","14.802500","BaiduOnl_fd:9e:c4","Broadcast","ARP","60","Who has 10.0.0.5? Tell 10.0.0.4"
"141","14.805540","BaiduOnl_fd:9e:c4","Broadcast","ARP","60","Who has 10.0.0.6? Tell 10.0.0.4"
"142","14.805540","BaiduOnl_fd:9e:c4","Broadcast","ARP","60","Who has 10.0.0.7? Tell 10.0.0.4"
"143","14.815574","BaiduOnl_fd:9e:c4","Broadcast","ARP","60","Who has 10.0.0.9? Tell 10.0.0.4"
"144","14.815627","BaiduOnl_fd:9e:c4","Broadcast","ARP","60","Who has 10.0.0.10? Tell 10.0.0.4"
"145","14.815850","BaiduOnl_fd:9e:c4","Broadcast","ARP","60","Who has 10.0.0.11? Tell 10.0.0.4"
"146","15.802393","BaiduOnl_fd:9e:c4","Broadcast","ARP","60","Who has 10.0.0.12? Tell 10.0.0.4"
"147","15.803387","BaiduOnl_fd:9e:c4","Broadcast","ARP","60","Who has 10.0.0.2? Tell 10.0.0.4"
"148","15.803387","BaiduOnl_fd:9e:c4","Broadcast","ARP","60","Who has 10.0.0.5? Tell 10.0.0.4"
"149","15.804630","BaiduOnl_fd:9e:c4","Broadcast","ARP","60","Who has 10.0.0.6? Tell 10.0.0.4"
"150","15.804630","BaiduOnl_fd:9e:c4","Broadcast","ARP","60","Who has 10.0.0.7? Tell 10.0.0.4"
"151","15.804860","BaiduOnl_fd:9e:c4","Broadcast","ARP","60","Who has 10.0.0.8? Tell 10.0.0.4"
"152","15.806013","BaiduOnl_fd:9e:c4","Broadcast","ARP","60","Who has 10.0.0.9? Tell 10.0.0.4"
"153","15.807673","BaiduOnl_fd:9e:c4","Broadcast","ARP","60","Who has 10.0.0.10? Tell 10.0.0.4"
"154","15.812908","BaiduOnl_fd:9e:c4","Broadcast","ARP","60","Who has 10.0.0.11? Tell 10.0.0.4"
"155","16.133134","10.0.0.3","104.18.47.230","TCP","55","58913 → 443 [ACK] Seq=1 Ack=1 Win=1023 Len=1 [TCP segment of a reassembled PDU]"
"156","16.327095","104.18.47.230","10.0.0.3","TCP","66","443 → 58913 [ACK] Seq=1 Ack=2 Win=64 Len=0 SLE=1 SRE=2"
"157","16.936725","Giga-Byt_01:fc:42","BaiduOnl_fd:9e:c4","ARP","42","Who has 10.0.0.4? Tell 10.0.0.3"
"158","16.938896","BaiduOnl_fd:9e:c4","Giga-Byt_01:fc:42","ARP","60","10.0.0.4 is at 88:2d:53:fd:9e:c4"
"159","17.326467","10.0.0.3","23.215.100.64","TCP","266","[TCP Retransmission] 58855 → 443 [FIN, PSH, ACK] Seq=1 Ack=1 Win=1024 Len=212"
"160","18.956294","10.0.0.3","239.100.1.1","ICEP","401","Request(oneway): stateReceiver.receiveStationRunningState()"
"161","18.956403","10.0.0.3","239.100.1.1","ICEP","108","Request(oneway): stateReceiver.receiveAppRunningState()"
"162","19.025629","10.0.0.3","239.100.1.1","ICEP","356","Request(oneway): stateReceiver.receiveNetStatistics()"
"163","19.161328","10.0.0.4","239.255.255.250","SSDP","243","M-SEARCH * HTTP/1.1 "
"164","20.401355","10.0.0.3","108.128.72.146","TLSv1.2","85","Application Data"
"165","20.619602","108.128.72.146","10.0.0.3","TCP","60","443 → 58530 [ACK] Seq=1 Ack=32 Win=60 Len=0"
"166","21.484340","Giga-Byt_01:fc:42","LLDP_Multicast","LLDP","58","MA/1c:1b:0d:01:fc:42 MA/1c:1b:0d:01:fc:42 3601 "
"167","23.580364","BaiduOnl_fd:9e:c4","Broadcast","ARP","60","Who has 10.0.0.1? Tell 10.0.0.4"
"168","24.004352","108.128.72.146","10.0.0.3","TLSv1.2","79","Application Data"
"169","24.051771","10.0.0.3","108.128.72.146","TCP","54","58530 → 443 [ACK] Seq=32 Ack=26 Win=1021 Len=0"
"170","24.147657","10.0.0.3","239.100.1.1","ICEP","401","Request(oneway): stateReceiver.receiveStationRunningState()"
"171","24.147784","10.0.0.3","239.100.1.1","ICEP","108","Request(oneway): stateReceiver.receiveAppRunningState()"
"172","24.211604","10.0.0.3","239.100.1.1","ICEP","355","Request(oneway): stateReceiver.receiveNetStatistics()"
"173","28.330078","203.208.50.73","10.0.0.3","TLSv1.2","127","Application Data"
"174","28.330667","10.0.0.3","203.208.50.73","TCP","54","58905 → 443 [FIN, ACK] Seq=2 Ack=74 Win=1026 Len=0"
"175","28.369512","203.208.50.73","10.0.0.3","TCP","60","443 → 58905 [FIN, ACK] Seq=74 Ack=3 Win=266 Len=0"
"176","28.369512","203.208.50.73","10.0.0.3","TCP","66","[TCP Dup ACK 175#1] 443 → 58905 [ACK] Seq=75 Ack=3 Win=266 Len=0 SLE=2 SRE=3"
"177","28.369618","10.0.0.3","203.208.50.73","TCP","54","58905 → 443 [ACK] Seq=3 Ack=75 Win=1026 Len=0"
"178","28.618583","203.208.43.97","10.0.0.3","TLSv1.2","127","Application Data"
"179","28.619106","10.0.0.3","203.208.43.97","TCP","54","58866 → 443 [FIN, ACK] Seq=2 Ack=74 Win=1023 Len=0"
"180","28.655639","203.208.43.97","10.0.0.3","TCP","60","443 → 58866 [FIN, ACK] Seq=74 Ack=3 Win=290 Len=0"
"181","28.655639","203.208.43.97","10.0.0.3","TCP","66","[TCP Dup ACK 180#1] 443 → 58866 [ACK] Seq=75 Ack=3 Win=290 Len=0 SLE=2 SRE=3"
"182","28.655746","10.0.0.3","203.208.43.97","TCP","54","58866 → 443 [ACK] Seq=3 Ack=75 Win=1023 Len=0"
"183","28.714870","203.208.43.70","10.0.0.3","TLSv1.2","127","Application Data"
"184","28.715432","10.0.0.3","203.208.43.70","TCP","54","58867 → 443 [FIN, ACK] Seq=2 Ack=74 Win=1026 Len=0"
"185","28.752491","203.208.43.70","10.0.0.3","TCP","60","443 → 58867 [FIN, ACK] Seq=74 Ack=3 Win=271 Len=0"
"186","28.752491","203.208.43.70","10.0.0.3","TCP","66","[TCP Dup ACK 185#1] 443 → 58867 [ACK] Seq=75 Ack=3 Win=271 Len=0 SLE=2 SRE=3"
"187","28.752596","10.0.0.3","203.208.43.70","TCP","54","58867 → 443 [ACK] Seq=3 Ack=75 Win=1026 Len=0"
"188","29.175807","10.0.0.3","23.53.40.192","TCP","54","[TCP Retransmission] 57433 → 443 [FIN, ACK] Seq=1 Ack=1 Win=1024 Len=0"
"189","29.285791","10.0.0.3","239.100.1.1","ICEP","401","Request(oneway): stateReceiver.receiveStationRunningState()"
"190","29.285901","10.0.0.3","239.100.1.1","ICEP","108","Request(oneway): stateReceiver.receiveAppRunningState()"
"191","29.332625","10.0.0.3","23.215.100.64","TCP","266","[TCP Retransmission] 58855 → 443 [FIN, PSH, ACK] Seq=1 Ack=1 Win=1024 Len=212"
"192","29.344750","10.0.0.3","239.100.1.1","ICEP","356","Request(oneway): stateReceiver.receiveNetStatistics()"
"193","29.944836","BaiduOnl_fd:9e:c4","Broadcast","ARP","60","Who has 10.0.0.2? Tell 10.0.0.4"
"194","29.946066","10.0.0.4","10.0.0.3","ICMP","74","Echo (ping) request  id=0xafaf, seq=0/0, ttl=255 (reply in 195)"
"195","29.946098","10.0.0.3","10.0.0.4","ICMP","74","Echo (ping) reply    id=0xafaf, seq=0/0, ttl=128 (request in 194)"
"196","29.948455","BaiduOnl_fd:9e:c4","Broadcast","ARP","60","Who has 10.0.0.5? Tell 10.0.0.4"
"197","29.950149","BaiduOnl_fd:9e:c4","Broadcast","ARP","60","Who has 10.0.0.6? Tell 10.0.0.4"
"198","29.951477","BaiduOnl_fd:9e:c4","Broadcast","ARP","60","Who has 10.0.0.7? Tell 10.0.0.4"
"199","29.951658","BaiduOnl_fd:9e:c4","Broadcast","ARP","60","Who has 10.0.0.8? Tell 10.0.0.4"
"200","29.952719","BaiduOnl_fd:9e:c4","Broadcast","ARP","60","Who has 10.0.0.9? Tell 10.0.0.4"
"201","29.953781","BaiduOnl_fd:9e:c4","Broadcast","ARP","60","Who has 10.0.0.10? Tell 10.0.0.4"
"202","29.955936","BaiduOnl_fd:9e:c4","Broadcast","ARP","60","Who has 10.0.0.11? Tell 10.0.0.4"
"203","29.955963","BaiduOnl_fd:9e:c4","Broadcast","ARP","60","Who has 10.0.0.12? Tell 10.0.0.4"
"204","30.803260","BaiduOnl_fd:9e:c4","Broadcast","ARP","60","Who has 10.0.0.2? Tell 10.0.0.4"
"205","30.804156","BaiduOnl_fd:9e:c4","Broadcast","ARP","60","Who has 10.0.0.12? Tell 10.0.0.4"
"206","30.805260","BaiduOnl_fd:9e:c4","Broadcast","ARP","60","Who has 10.0.0.5? Tell 10.0.0.4"
"207","30.805260","BaiduOnl_fd:9e:c4","Broadcast","ARP","60","Who has 10.0.0.6? Tell 10.0.0.4"
"208","30.806486","BaiduOnl_fd:9e:c4","Broadcast","ARP","60","Who has 10.0.0.7? Tell 10.0.0.4"
"209","30.807691","BaiduOnl_fd:9e:c4","Broadcast","ARP","60","Who has 10.0.0.8? Tell 10.0.0.4"
"210","30.809731","BaiduOnl_fd:9e:c4","Broadcast","ARP","60","Who has 10.0.0.9? Tell 10.0.0.4"
"211","30.809731","BaiduOnl_fd:9e:c4","Broadcast","ARP","60","Who has 10.0.0.10? Tell 10.0.0.4"
"212","30.810962","BaiduOnl_fd:9e:c4","Broadcast","ARP","60","Who has 10.0.0.11? Tell 10.0.0.4"
"213","30.976131","10.0.0.3","23.204.146.194","TCP","55","58883 → 443 [ACK] Seq=1 Ack=1 Win=1025 Len=1 [TCP segment of a reassembled PDU]"
"214","31.079434","10.0.0.3","117.18.232.200","TCP","54","58841 → 443 [RST, ACK] Seq=2 Ack=1 Win=0 Len=0"
"215","31.804218","BaiduOnl_fd:9e:c4","Broadcast","ARP","60","Who has 10.0.0.2? Tell 10.0.0.4"
"216","31.805629","BaiduOnl_fd:9e:c4","Broadcast","ARP","60","Who has 10.0.0.12? Tell 10.0.0.4"
"217","31.806720","BaiduOnl_fd:9e:c4","Broadcast","ARP","60","Who has 10.0.0.5? Tell 10.0.0.4"
"218","31.807683","BaiduOnl_fd:9e:c4","Broadcast","ARP","60","Who has 10.0.0.6? Tell 10.0.0.4"
"219","31.808679","BaiduOnl_fd:9e:c4","Broadcast","ARP","60","Who has 10.0.0.7? Tell 10.0.0.4"
"220","31.809679","BaiduOnl_fd:9e:c4","Broadcast","ARP","60","Who has 10.0.0.8? Tell 10.0.0.4"
"221","31.810835","BaiduOnl_fd:9e:c4","Broadcast","ARP","60","Who has 10.0.0.9? Tell 10.0.0.4"
"222","31.810938","BaiduOnl_fd:9e:c4","Broadcast","ARP","60","Who has 10.0.0.10? Tell 10.0.0.4"
"223","31.812097","BaiduOnl_fd:9e:c4","Broadcast","ARP","60","Who has 10.0.0.11? Tell 10.0.0.4"
"224","31.961919","10.0.0.3","192.241.241.96","TCP","55","55649 → 443 [ACK] Seq=1 Ack=1 Win=1025 Len=1 [TCP segment of a reassembled PDU]"
"225","32.164518","10.0.0.1","239.255.255.250","SSDP","330","NOTIFY * HTTP/1.1 "
"226","32.164518","10.0.0.1","239.255.255.250","SSDP","339","NOTIFY * HTTP/1.1 "
"227","32.164518","10.0.0.1","239.255.255.250","SSDP","402","NOTIFY * HTTP/1.1 "
"228","32.164518","10.0.0.1","239.255.255.250","SSDP","339","NOTIFY * HTTP/1.1 "
"229","32.164724","10.0.0.1","239.255.255.250","SSDP","376","NOTIFY * HTTP/1.1 "
"230","32.164724","10.0.0.1","239.255.255.250","SSDP","339","NOTIFY * HTTP/1.1 "
"231","32.164724","10.0.0.1","239.255.255.250","SSDP","396","NOTIFY * HTTP/1.1 "
"232","32.164803","10.0.0.1","239.255.255.250","SSDP","394","NOTIFY * HTTP/1.1 "
"233","32.164966","10.0.0.1","239.255.255.250","SSDP","410","NOTIFY * HTTP/1.1 "
"234","32.165046","10.0.0.1","239.255.255.250","SSDP","404","NOTIFY * HTTP/1.1 "
"235","32.165213","10.0.0.1","239.255.255.250","SSDP","392","NOTIFY * HTTP/1.1 "
"236","32.165265","10.0.0.1","239.255.255.250","SSDP","394","NOTIFY * HTTP/1.1 "
"237","32.229532","192.241.241.96","10.0.0.3","TCP","66","443 → 55649 [ACK] Seq=1 Ack=2 Win=501 Len=0 SLE=1 SRE=2"
"238","32.809945","BaiduOnl_fd:9e:c4","Broadcast","ARP","60","Who has 10.0.0.2? Tell 10.0.0.4"
"239","32.809967","BaiduOnl_fd:9e:c4","Broadcast","ARP","60","Who has 10.0.0.12? Tell 10.0.0.4"
"240","32.810165","BaiduOnl_fd:9e:c4","Broadcast","ARP","60","Who has 10.0.0.5? Tell 10.0.0.4"
"241","32.810366","BaiduOnl_fd:9e:c4","Broadcast","ARP","60","Who has 10.0.0.6? Tell 10.0.0.4"
"242","32.810591","BaiduOnl_fd:9e:c4","Broadcast","ARP","60","Who has 10.0.0.7? Tell 10.0.0.4"
"243","32.811780","BaiduOnl_fd:9e:c4","Broadcast","ARP","60","Who has 10.0.0.8? Tell 10.0.0.4"
"244","32.813854","BaiduOnl_fd:9e:c4","Broadcast","ARP","60","Who has 10.0.0.9? Tell 10.0.0.4"
"245","32.813854","BaiduOnl_fd:9e:c4","Broadcast","ARP","60","Who has 10.0.0.10? Tell 10.0.0.4"
"246","32.814186","BaiduOnl_fd:9e:c4","Broadcast","ARP","60","Who has 10.0.0.11? Tell 10.0.0.4"
"247","33.627925","10.0.0.3","13.67.9.5","TCP","55","57944 → 443 [ACK] Seq=1 Ack=1 Win=1026 Len=1 [TCP segment of a reassembled PDU]"
"248","33.741081","13.67.9.5","10.0.0.3","TCP","66","443 → 57944 [ACK] Seq=1 Ack=2 Win=1026 Len=0 SLE=1 SRE=2"
"249","33.806125","BaiduOnl_fd:9e:c4","Broadcast","ARP","60","Who has 10.0.0.2? Tell 10.0.0.4"
"250","33.807166","BaiduOnl_fd:9e:c4","Broadcast","ARP","60","Who has 10.0.0.12? Tell 10.0.0.4"
"251","33.808311","BaiduOnl_fd:9e:c4","Broadcast","ARP","60","Who has 10.0.0.5? Tell 10.0.0.4"
"252","33.808465","BaiduOnl_fd:9e:c4","Broadcast","ARP","60","Who has 10.0.0.6? Tell 10.0.0.4"
"253","33.808589","BaiduOnl_fd:9e:c4","Broadcast","ARP","60","Who has 10.0.0.7? Tell 10.0.0.4"
"254","33.808804","BaiduOnl_fd:9e:c4","Broadcast","ARP","60","Who has 10.0.0.8? Tell 10.0.0.4"
"255","33.809973","BaiduOnl_fd:9e:c4","Broadcast","ARP","60","Who has 10.0.0.9? Tell 10.0.0.4"
"256","33.809973","BaiduOnl_fd:9e:c4","Broadcast","ARP","60","Who has 10.0.0.10? Tell 10.0.0.4"
"257","33.810159","BaiduOnl_fd:9e:c4","Broadcast","ARP","60","Who has 10.0.0.11? Tell 10.0.0.4"
"258","34.029178","10.0.0.3","99.84.194.10","TCP","55","58864 → 443 [ACK] Seq=1 Ack=1 Win=1025 Len=1 [TCP segment of a reassembled PDU]"
"259","34.218088","99.84.194.10","10.0.0.3","TCP","60","443 → 58864 [ACK] Seq=1 Ack=2 Win=159 Len=0"
"260","34.435850","10.0.0.3","239.100.1.1","ICEP","401","Request(oneway): stateReceiver.receiveStationRunningState()"
"261","34.435915","10.0.0.3","239.100.1.1","ICEP","108","Request(oneway): stateReceiver.receiveAppRunningState()"
"262","34.501839","10.0.0.3","239.100.1.1","ICEP","356","Request(oneway): stateReceiver.receiveNetStatistics()"
"263","36.172730","10.0.0.3","10.0.0.1","DNS","69","Standard query 0x7d17 A doc.qt.io"
"264","36.172730","10.0.0.3","10.0.0.1","DNS","71","Standard query 0xa3cd A cn.bing.com"
"265","36.173853","10.0.0.3","10.0.0.1","DNS","89","Standard query 0x2024 A d33sqmjvzgs8hq.cloudfront.net"
"266","36.173883","10.0.0.3","10.0.0.1","DNS","69","Standard query 0x7d85 A www.qt.io"
"267","36.179610","10.0.0.3","13.225.141.19","TCP","54","58892 → 443 [FIN, ACK] Seq=1 Ack=65 Win=1027 Len=0"
"268","36.179640","10.0.0.3","13.225.141.19","TCP","54","58892 → 443 [RST, ACK] Seq=2 Ack=65 Win=0 Len=0"
"269","36.179729","10.0.0.3","99.84.194.10","TCP","54","58864 → 443 [FIN, ACK] Seq=2 Ack=1 Win=1025 Len=0"
"270","36.179742","10.0.0.3","99.84.194.10","TCP","54","58864 → 443 [RST, ACK] Seq=3 Ack=1 Win=0 Len=0"
"271","36.201891","10.0.0.1","10.0.0.3","DNS","179","Standard query response 0xa3cd A cn.bing.com CNAME cn-bing-com.cn.a-0001.a-msedge.net CNAME china.bing123.com A 202.89.233.100 A 202.89.233.101"
"272","36.206611","10.0.0.1","10.0.0.3","DNS","85","Standard query response 0x7d17 A doc.qt.io A 18.203.89.116"
"273","36.206974","10.0.0.1","10.0.0.3","DNS","221","Standard query response 0x7d85 A www.qt.io CNAME 149513g13.secure0130.hubspot.net CNAME 149513.group13.sites.hubspot.net CNAME group13.sites.hscoscdn10.net A 199.60.103.225 A 199.60.103.31"
"274","36.207257","10.0.0.3","18.203.89.116","TCP","66","59055 → 443 [SYN] Seq=0 Win=64240 Len=0 MSS=1460 WS=256 SACK_PERM=1"
"275","36.208076","10.0.0.3","18.203.89.116","TCP","66","59056 → 443 [SYN] Seq=0 Win=64240 Len=0 MSS=1460 WS=256 SACK_PERM=1"
"276","36.208286","10.0.0.3","199.60.103.225","TCP","66","59057 → 443 [SYN] Seq=0 Win=64240 Len=0 MSS=1460 WS=256 SACK_PERM=1"
"277","36.208826","10.0.0.3","10.0.0.1","DNS","77","Standard query 0x5324 A fonts.gstatic.com"
"278","36.209835","10.0.0.1","10.0.0.3","DNS","153","Standard query response 0x2024 A d33sqmjvzgs8hq.cloudfront.net A 99.84.194.150 A 99.84.194.163 A 99.84.194.86 A 99.84.194.10"
"279","36.210682","10.0.0.3","99.84.194.150","TCP","66","59058 → 443 [SYN] Seq=0 Win=64240 Len=0 MSS=1460 WS=256 SACK_PERM=1"
"280","36.237021","10.0.0.1","10.0.0.3","DNS","129","Standard query response 0x5324 A fonts.gstatic.com CNAME gstaticadssl.l.google.com A 203.208.39.194"
"281","36.238232","10.0.0.3","203.208.39.194","QUIC","1292","Initial, DCID=336121561fe0bef8, PKN: 1, PADDING, CRYPTO, CRYPTO, CRYPTO, PADDING, CRYPTO, CRYPTO, PADDING, PING, PING, CRYPTO"
"282","36.238398","10.0.0.3","203.208.39.194","QUIC","122","0-RTT, DCID=336121561fe0bef8"
"283","36.327655","203.208.39.194","10.0.0.3","QUIC","1292","Protected Payload (KP0)"
"284","36.327655","203.208.39.194","10.0.0.3","QUIC","664","Protected Payload (KP0)"
"285","36.328977","10.0.0.3","203.208.39.194","QUIC","121","Handshake, DCID=336121561fe0bef8"
"286","36.329212","10.0.0.3","203.208.39.194","QUIC","75","Protected Payload (KP0), DCID=336121561fe0bef8"
"287","36.368928","99.84.194.10","10.0.0.3","TCP","60","443 → 58864 [ACK] Seq=1 Ack=3 Win=159 Len=0"
"288","36.368928","13.225.141.19","10.0.0.3","TCP","60","443 → 58892 [ACK] Seq=65 Ack=2 Win=131 Len=0"
"289","36.405157","203.208.39.194","10.0.0.3","QUIC","135","Protected Payload (KP0)"
"290","36.413225","99.84.194.150","10.0.0.3","TCP","66","443 → 59058 [SYN, ACK] Seq=0 Ack=1 Win=65535 Len=0 MSS=1440 SACK_PERM=1 WS=512"
"291","36.413290","10.0.0.3","99.84.194.150","TCP","54","59058 → 443 [ACK] Seq=1 Ack=1 Win=263424 Len=0"
"292","36.413552","10.0.0.3","99.84.194.150","TLSv1.2","571","Client Hello"
"293","36.430552","10.0.0.3","18.203.89.116","TCP","66","59059 → 443 [SYN] Seq=0 Win=64240 Len=0 MSS=1460 WS=256 SACK_PERM=1"
"294","36.430641","10.0.0.3","203.208.39.194","QUIC","75","Protected Payload (KP0), DCID=336121561fe0bef8"
"295","36.439366","18.203.89.116","10.0.0.3","TCP","66","443 → 59055 [SYN, ACK] Seq=0 Ack=1 Win=62727 Len=0 MSS=1452 SACK_PERM=1 WS=128"
"296","36.439427","10.0.0.3","18.203.89.116","TCP","54","59055 → 443 [ACK] Seq=1 Ack=1 Win=262656 Len=0"
"297","36.439696","10.0.0.3","18.203.89.116","TLSv1.2","574","Client Hello"
"298","36.449349","10.0.0.3","203.208.39.194","QUIC","114","Protected Payload (KP0), DCID=336121561fe0bef8"
"299","36.525081","203.208.39.194","10.0.0.3","QUIC","67","Protected Payload (KP0)"
"300","36.660255","18.203.89.116","10.0.0.3","TCP","66","443 → 59059 [SYN, ACK] Seq=0 Ack=1 Win=62727 Len=0 MSS=1452 SACK_PERM=1 WS=128"
"301","36.660314","10.0.0.3","18.203.89.116","TCP","54","59059 → 443 [ACK] Seq=1 Ack=1 Win=262656 Len=0"
"302","36.660603","10.0.0.3","18.203.89.116","TLSv1.2","574","Client Hello"
"303","36.671837","18.203.89.116","10.0.0.3","TCP","60","443 → 59055 [ACK] Seq=1 Ack=521 Win=62208 Len=0"
"304","36.673239","18.203.89.116","10.0.0.3","TLSv1.2","1506","Server Hello"
"305","36.673239","18.203.89.116","10.0.0.3","TCP","1506","443 → 59055 [ACK] Seq=1453 Ack=521 Win=62208 Len=1452 [TCP segment of a reassembled PDU]"
"306","36.673297","10.0.0.3","18.203.89.116","TCP","54","59055 → 443 [ACK] Seq=521 Ack=2905 Win=262656 Len=0"
"307","36.890050","18.203.89.116","10.0.0.3","TCP","60","443 → 59059 [ACK] Seq=1 Ack=521 Win=62208 Len=0"
"308","36.891485","18.203.89.116","10.0.0.3","TLSv1.2","1506","Server Hello"
"309","36.891522","18.203.89.116","10.0.0.3","TCP","1506","443 → 59059 [ACK] Seq=1453 Ack=521 Win=62208 Len=1452 [TCP segment of a reassembled PDU]"
"310","36.891539","10.0.0.3","18.203.89.116","TCP","54","59059 → 443 [ACK] Seq=521 Ack=2905 Win=262656 Len=0"
"311","36.891749","18.203.89.116","10.0.0.3","TLSv1.2","493","Certificate, Server Key Exchange, Server Hello Done"
"312","36.892110","10.0.0.3","18.203.89.116","TLSv1.2","147","Client Key Exchange, Change Cipher Spec, Encrypted Handshake Message"
"313","36.892372","10.0.0.3","18.203.89.116","TLSv1.2","1340","Application Data"
"314","36.913326","10.0.0.3","99.84.194.150","TCP","571","[TCP Retransmission] 59058 → 443 [PSH, ACK] Seq=1 Ack=1 Win=263424 Len=517"
"315","37.115615","99.84.194.150","10.0.0.3","TCP","66","[TCP Previous segment not captured] 443 → 59058 [ACK] Seq=226 Ack=518 Win=67072 Len=0 SLE=1 SRE=518"
"316","37.210874","10.0.0.3","199.60.103.225","TCP","66","[TCP Retransmission] [TCP Port numbers reused] 59057 → 443 [SYN] Seq=0 Win=64240 Len=0 MSS=1460 WS=256 SACK_PERM=1"
"317","37.210887","10.0.0.3","18.203.89.116","TCP","66","[TCP Retransmission] [TCP Port numbers reused] 59056 → 443 [SYN] Seq=0 Win=64240 Len=0 MSS=1460 WS=256 SACK_PERM=1"
"318","37.230712","99.84.194.150","10.0.0.3","TCP","279","[TCP Retransmission] 443 → 59058 [PSH, ACK] Seq=1 Ack=518 Win=67072 Len=225"
"319","37.231017","10.0.0.3","99.84.194.150","TLSv1.2","118","Change Cipher Spec, Application Data"
"320","37.400341","199.60.103.225","10.0.0.3","TCP","66","443 → 59057 [SYN, ACK] Seq=0 Ack=1 Win=65535 Len=0 MSS=1452 SACK_PERM=1 WS=1024"
"321","37.400396","10.0.0.3","199.60.103.225","TCP","54","59057 → 443 [ACK] Seq=1 Ack=1 Win=262656 Len=0"
"322","37.400669","10.0.0.3","199.60.103.225","TLSv1.3","600","Client Hello"
"323","37.432877","10.0.0.3","18.203.89.116","TCP","1433","[TCP Retransmission] 59059 → 443 [PSH, ACK] Seq=521 Ack=3344 Win=262144 Len=1379"
"324","37.433252","99.84.194.150","10.0.0.3","TCP","60","443 → 59058 [ACK] Seq=226 Ack=582 Win=67072 Len=0"
"325","37.433252","99.84.194.150","10.0.0.3","TLSv1.2","200","Application Data"
"326","37.480915","10.0.0.3","99.84.194.150","TCP","54","59058 → 443 [ACK] Seq=582 Ack=372 Win=262912 Len=0"
"327","37.589646","199.60.103.225","10.0.0.3","TCP","60","443 → 59057 [ACK] Seq=1 Ack=547 Win=68608 Len=0"
"328","37.590263","18.203.89.116","10.0.0.3","TLSv1.2","380","[TCP Previous segment not captured] , Application Data"
"329","37.590285","10.0.0.3","18.203.89.116","TCP","66","[TCP Dup ACK 312#1] 59059 → 443 [ACK] Seq=1900 Ack=3344 Win=262144 Len=0 SLE=3618 SRE=3944"
"330","37.591493","18.203.89.116","10.0.0.3","TLSv1.2","493","Certificate, Server Key Exchange, Server Hello Done"
"331","37.591819","10.0.0.3","18.203.89.116","TLSv1.2","147","Client Key Exchange, Change Cipher Spec, Encrypted Handshake Message"
"332","37.601817","199.60.103.225","10.0.0.3","TLSv1.3","266","Server Hello, Change Cipher Spec, Application Data"
"333","37.602184","10.0.0.3","199.60.103.225","TLSv1.3","118","Change Cipher Spec, Application Data"
"334","37.662269","18.203.89.116","10.0.0.3","TCP","66","[TCP Dup ACK 328#1] 443 → 59059 [ACK] Seq=3944 Ack=1900 Win=60928 Len=0 SLE=521 SRE=1900"
"335","37.791324","199.60.103.225","10.0.0.3","TCP","60","443 → 59057 [ACK] Seq=213 Ack=611 Win=68608 Len=0"
"336","37.824081","18.203.89.116","10.0.0.3","TLSv1.2","328","New Session Ticket, Change Cipher Spec, Encrypted Handshake Message"
"337","37.864902","10.0.0.3","18.203.89.116","TCP","54","59055 → 443 [ACK] Seq=614 Ack=3618 Win=261888 Len=0"
"338","38.294513","18.203.89.116","10.0.0.3","TCP","328","[TCP Retransmission] 443 → 59059 [PSH, ACK] Seq=3344 Ack=1900 Win=60928 Len=274"
"339","38.294556","10.0.0.3","18.203.89.116","TCP","54","59059 → 443 [ACK] Seq=1900 Ack=3944 Win=261632 Len=0"
"340","38.383121","199.60.103.225","10.0.0.3","TLSv1.3","582","Application Data, Application Data"
"341","38.428301","10.0.0.3","99.84.194.150","TLSv1.2","798","Application Data"
"342","38.436859","10.0.0.3","199.60.103.225","TCP","54","59057 → 443 [ACK] Seq=611 Ack=741 Win=261888 Len=0"
"343","38.452474","18.203.89.116","10.0.0.3","TCP","66","443 → 59056 [SYN, ACK] Seq=0 Ack=1 Win=62727 Len=0 MSS=1452 SACK_PERM=1 WS=128"
"344","38.452530","10.0.0.3","18.203.89.116","TCP","54","59056 → 443 [ACK] Seq=1 Ack=1 Win=262656 Len=0"
"345","38.452703","10.0.0.3","18.203.89.116","TLSv1.2","574","Client Hello"
"346","38.630417","99.84.194.150","10.0.0.3","TCP","60","443 → 59058 [ACK] Seq=372 Ack=1326 Win=68096 Len=0"
"347","38.655835","99.84.194.150","10.0.0.3","TLSv1.2","467","Application Data"
"348","38.682962","18.203.89.116","10.0.0.3","TCP","60","443 → 59056 [ACK] Seq=1 Ack=521 Win=62208 Len=0"
"349","38.683095","18.203.89.116","10.0.0.3","TLSv1.2","210","Server Hello, Change Cipher Spec, Encrypted Handshake Message"
"350","38.683317","10.0.0.3","18.203.89.116","TLSv1.2","105","Change Cipher Spec, Encrypted Handshake Message"
"351","38.706868","10.0.0.3","99.84.194.150","TCP","54","59058 → 443 [ACK] Seq=1326 Ack=785 Win=262656 Len=0"
"352","38.850170","10.0.0.3","10.0.0.1","DNS","84","Standard query 0x7884 A www.google-analytics.com"
"353","38.871854","10.0.0.3","18.203.89.116","TLSv1.2","1111","Application Data"
"354","38.872191","10.0.0.3","18.203.89.116","TLSv1.2","1113","Application Data"
"355","38.880903","10.0.0.3","10.0.0.1","DNS","84","Standard query 0x7884 A www.google-analytics.com"
"356","38.956409","18.203.89.116","10.0.0.3","TCP","60","443 → 59056 [ACK] Seq=157 Ack=572 Win=62208 Len=0"
"357","39.101226","18.203.89.116","10.0.0.3","TCP","60","443 → 59059 [ACK] Seq=3944 Ack=2957 Win=59904 Len=0"
"358","39.101311","18.203.89.116","10.0.0.3","TLSv1.2","421","Application Data"
"359","39.104152","18.203.89.116","10.0.0.3","TLSv1.2","421","Application Data"
"360","39.132163","10.0.0.3","99.84.194.150","TLSv1.2","862","Application Data"
"361","39.148841","10.0.0.3","18.203.89.116","TCP","54","59055 → 443 [ACK] Seq=1673 Ack=3985 Win=261632 Len=0"
"362","39.148871","10.0.0.3","18.203.89.116","TCP","54","59059 → 443 [ACK] Seq=2957 Ack=4311 Win=261376 Len=0"
"363","39.166920","10.0.0.4","239.255.255.250","SSDP","243","M-SEARCH * HTTP/1.1 "
"364","39.334244","99.84.194.150","10.0.0.3","TCP","60","443 → 59058 [ACK] Seq=785 Ack=2134 Win=70144 Len=0"
"365","39.572116","10.0.0.3","239.100.1.1","ICEP","401","Request(oneway): stateReceiver.receiveStationRunningState()"
"366","39.572143","10.0.0.3","239.100.1.1","ICEP","108","Request(oneway): stateReceiver.receiveAppRunningState()"
"367","39.597834","10.0.0.3","239.100.1.1","ICEP","356","Request(oneway): stateReceiver.receiveNetStatistics()"
"368","39.884272","10.0.0.3","10.0.0.1","DNS","84","Standard query 0x7884 A www.google-analytics.com"
"369","39.917041","10.0.0.1","10.0.0.3","DNS","100","Standard query response 0x7884 A www.google-analytics.com A 203.208.39.225"
"370","39.917532","10.0.0.3","203.208.39.225","TCP","66","59061 → 443 [SYN] Seq=0 Win=64240 Len=0 MSS=1460 WS=256 SACK_PERM=1"
"371","39.955823","203.208.39.225","10.0.0.3","TCP","66","443 → 59061 [SYN, ACK] Seq=0 Ack=1 Win=65535 Len=0 MSS=1452 SACK_PERM=1 WS=256"
"372","39.955874","10.0.0.3","203.208.39.225","TCP","54","59061 → 443 [ACK] Seq=1 Ack=1 Win=262656 Len=0"
"373","39.956122","10.0.0.3","203.208.39.225","TLSv1.3","655","Client Hello"
"374","39.994165","203.208.39.225","10.0.0.3","TCP","60","443 → 59061 [ACK] Seq=1 Ack=602 Win=66816 Len=0"
"375","40.044952","203.208.39.225","10.0.0.3","TLSv1.3","266","Server Hello, Change Cipher Spec, Application Data"
"376","40.045277","10.0.0.3","203.208.39.225","TLSv1.3","118","Change Cipher Spec, Application Data"
"377","40.045376","10.0.0.3","203.208.39.225","TLSv1.3","146","Application Data"
"378","40.045477","10.0.0.3","203.208.39.225","TLSv1.3","779","Application Data"
"379","40.083344","203.208.39.225","10.0.0.3","TCP","60","443 → 59061 [ACK] Seq=213 Ack=666 Win=66816 Len=0"
"380","40.083344","203.208.39.225","10.0.0.3","TCP","60","443 → 59061 [ACK] Seq=213 Ack=758 Win=66816 Len=0"
"381","40.083599","203.208.39.225","10.0.0.3","TCP","60","443 → 59061 [ACK] Seq=213 Ack=1483 Win=68352 Len=0"
"382","40.121505","203.208.39.225","10.0.0.3","TLSv1.3","693","Application Data, Application Data, Application Data"
"383","40.122066","10.0.0.3","203.208.39.225","TLSv1.3","85","Application Data"
"384","40.134677","203.208.39.225","10.0.0.3","TLSv1.3","457","Application Data"
"385","40.134677","203.208.39.225","10.0.0.3","TLSv1.3","89","Application Data"
"386","40.134677","203.208.39.225","10.0.0.3","TLSv1.3","85","Application Data"
"387","40.134818","10.0.0.3","203.208.39.225","TCP","54","59061 → 443 [ACK] Seq=1514 Ack=1321 Win=261376 Len=0"
"388","40.134880","203.208.39.225","10.0.0.3","TLSv1.3","93","Application Data"
"389","40.134926","10.0.0.3","203.208.39.225","TCP","54","59061 → 443 [ACK] Seq=1514 Ack=1360 Win=261376 Len=0"
"390","40.135695","10.0.0.3","203.208.39.225","TLSv1.3","93","Application Data"
"391","40.155302","10.0.0.3","10.0.0.1","DNS","83","Standard query 0x8973 A stats.g.doubleclick.net"
"392","40.164652","203.208.39.225","10.0.0.3","TCP","60","443 → 59061 [ACK] Seq=1360 Ack=1514 Win=68352 Len=0"
"393","40.173414","203.208.39.225","10.0.0.3","TCP","60","443 → 59061 [ACK] Seq=1360 Ack=1553 Win=68352 Len=0"
"394","40.181190","10.0.0.3","10.0.0.1","DNS","83","Standard query 0x8973 A stats.g.doubleclick.net"
"395","41.195514","10.0.0.3","10.0.0.1","DNS","83","Standard query 0x8973 A stats.g.doubleclick.net"
"396","41.231786","10.0.0.1","10.0.0.3","DNS","121","Standard query response 0x8973 A stats.g.doubleclick.net CNAME stats.l.doubleclick.net A 203.208.43.102"
"397","41.232228","10.0.0.3","203.208.43.102","TCP","66","59063 → 443 [SYN] Seq=0 Win=64240 Len=0 MSS=1460 WS=256 SACK_PERM=1"
"398","41.268796","203.208.43.102","10.0.0.3","TCP","66","443 → 59063 [SYN, ACK] Seq=0 Ack=1 Win=65535 Len=0 MSS=1452 SACK_PERM=1 WS=256"
"399","41.268843","10.0.0.3","203.208.43.102","TCP","54","59063 → 443 [ACK] Seq=1 Ack=1 Win=262656 Len=0"
"400","41.269070","10.0.0.3","203.208.43.102","TLSv1.3","654","Client Hello"
"401","41.305707","203.208.43.102","10.0.0.3","TCP","60","443 → 59063 [ACK] Seq=1 Ack=601 Win=66816 Len=0"
"402","41.336088","10.0.0.3","23.215.100.64","TCP","266","[TCP Retransmission] 58855 → 443 [FIN, PSH, ACK] Seq=1 Ack=1 Win=1024 Len=212"
"403","41.358231","203.208.43.102","10.0.0.3","TLSv1.3","266","Server Hello, Change Cipher Spec, Application Data"
"404","41.358560","10.0.0.3","203.208.43.102","TLSv1.3","118","Change Cipher Spec, Application Data"
"405","41.358659","10.0.0.3","203.208.43.102","TLSv1.3","146","Application Data"
"406","41.358753","10.0.0.3","203.208.43.102","TLSv1.3","607","Application Data"
"407","41.395195","203.208.43.102","10.0.0.3","TCP","60","443 → 59063 [ACK] Seq=213 Ack=665 Win=66816 Len=0"
"408","41.395195","203.208.43.102","10.0.0.3","TCP","60","443 → 59063 [ACK] Seq=213 Ack=757 Win=66816 Len=0"
"409","41.395333","203.208.43.102","10.0.0.3","TCP","60","443 → 59063 [ACK] Seq=213 Ack=1310 Win=68096 Len=0"
"410","41.435307","203.208.43.102","10.0.0.3","TLSv1.3","662","Application Data, Application Data"
"411","41.435476","203.208.43.102","10.0.0.3","TLSv1.3","85","Application Data"
"412","41.435490","10.0.0.3","203.208.43.102","TCP","54","59063 → 443 [ACK] Seq=1310 Ack=852 Win=261888 Len=0"
"413","41.435589","10.0.0.3","203.208.43.102","TLSv1.3","85","Application Data"
"414","41.448059","203.208.43.102","10.0.0.3","TLSv1.3","491","Application Data"
"415","41.448135","203.208.43.102","10.0.0.3","TLSv1.3","86","Application Data"
"416","41.448149","10.0.0.3","203.208.43.102","TCP","54","59063 → 443 [ACK] Seq=1341 Ack=1321 Win=261376 Len=0"
"417","41.448767","203.208.43.102","10.0.0.3","TLSv1.3","85","Application Data"
"418","41.448866","203.208.43.102","10.0.0.3","TLSv1.3","93","Application Data"
"419","41.448881","10.0.0.3","203.208.43.102","TCP","54","59063 → 443 [ACK] Seq=1341 Ack=1391 Win=261376 Len=0"
"420","41.448965","10.0.0.3","203.208.43.102","TLSv1.3","93","Application Data"
"421","41.472022","203.208.43.102","10.0.0.3","TCP","60","443 → 59063 [ACK] Seq=1391 Ack=1341 Win=68096 Len=0"
"422","41.485285","203.208.43.102","10.0.0.3","TCP","60","443 → 59063 [ACK] Seq=1391 Ack=1380 Win=68096 Len=0"
"423","41.810418","99.84.194.150","10.0.0.3","TLSv1.2","468","Application Data"
"424","41.815760","10.0.0.3","99.84.194.150","TLSv1.2","862","Application Data"
"425","42.018661","99.84.194.150","10.0.0.3","TLSv1.2","515","Application Data"
"426","42.023928","10.0.0.3","99.84.194.150","TLSv1.2","760","Application Data"
"427","42.113990","BaiduOnl_fd:9e:c4","Broadcast","ARP","60","ARP Announcement for 10.0.0.4"
"428","42.371032","10.0.0.3","99.84.194.150","TCP","760","[TCP Retransmission] 59058 → 443 [PSH, ACK] Seq=2942 Ack=1660 Win=263424 Len=706"
"429","42.573165","99.84.194.150","10.0.0.3","TCP","66","[TCP Previous segment not captured] 443 → 59058 [ACK] Seq=2842 Ack=3648 Win=73216 Len=0 SLE=2942 SRE=3648"
"430","42.790763","99.84.194.150","10.0.0.3","TCP","1236","[TCP Retransmission] 443 → 59058 [PSH, ACK] Seq=1660 Ack=3648 Win=73216 Len=1182"
"431","42.839774","10.0.0.3","99.84.194.150","TCP","54","59058 → 443 [ACK] Seq=3648 Ack=2842 Win=262144 Len=0"
"432","44.673609","10.0.0.3","239.100.1.1","ICEP","401","Request(oneway): stateReceiver.receiveStationRunningState()"
"433","44.673637","10.0.0.3","239.100.1.1","ICEP","108","Request(oneway): stateReceiver.receiveAppRunningState()"
"434","44.696800","10.0.0.3","239.100.1.1","ICEP","356","Request(oneway): stateReceiver.receiveNetStatistics()"
"435","47.955884","BaiduOnl_fd:9e:c4","Broadcast","ARP","60","Who has 10.0.0.2? Tell 10.0.0.4"
"436","47.956699","BaiduOnl_fd:9e:c4","Broadcast","ARP","60","Who has 10.0.0.3? Tell 10.0.0.4"
"437","47.956729","Giga-Byt_01:fc:42","BaiduOnl_fd:9e:c4","ARP","42","10.0.0.3 is at 1c:1b:0d:01:fc:42"
"438","47.958344","BaiduOnl_fd:9e:c4","Broadcast","ARP","60","Who has 10.0.0.5? Tell 10.0.0.4"
"439","47.959386","10.0.0.4","10.0.0.3","ICMP","74","Echo (ping) request  id=0xafaf, seq=0/0, ttl=255 (reply in 440)"
"440","47.959480","10.0.0.3","10.0.0.4","ICMP","74","Echo (ping) reply    id=0xafaf, seq=0/0, ttl=128 (request in 439)"
"441","47.961649","BaiduOnl_fd:9e:c4","Broadcast","ARP","60","Who has 10.0.0.6? Tell 10.0.0.4"
"442","47.965591","BaiduOnl_fd:9e:c4","Broadcast","ARP","60","Who has 10.0.0.7? Tell 10.0.0.4"
"443","47.965591","BaiduOnl_fd:9e:c4","Broadcast","ARP","60","Who has 10.0.0.8? Tell 10.0.0.4"
"444","47.965651","BaiduOnl_fd:9e:c4","Broadcast","ARP","60","Who has 10.0.0.9? Tell 10.0.0.4"
"445","47.966035","BaiduOnl_fd:9e:c4","Broadcast","ARP","60","Who has 10.0.0.10? Tell 10.0.0.4"
"446","47.968964","BaiduOnl_fd:9e:c4","Broadcast","ARP","60","Who has 10.0.0.11? Tell 10.0.0.4"
"447","47.970001","BaiduOnl_fd:9e:c4","Broadcast","ARP","60","Who has 10.0.0.12? Tell 10.0.0.4"
"448","48.807683","BaiduOnl_fd:9e:c4","Broadcast","ARP","60","Who has 10.0.0.12? Tell 10.0.0.4"
"449","48.808683","BaiduOnl_fd:9e:c4","Broadcast","ARP","60","Who has 10.0.0.2? Tell 10.0.0.4"
"450","48.808947","BaiduOnl_fd:9e:c4","Broadcast","ARP","60","Who has 10.0.0.5? Tell 10.0.0.4"
"451","48.809947","BaiduOnl_fd:9e:c4","Broadcast","ARP","60","Who has 10.0.0.6? Tell 10.0.0.4"
"452","48.811220","BaiduOnl_fd:9e:c4","Broadcast","ARP","60","Who has 10.0.0.7? Tell 10.0.0.4"
"453","48.811475","BaiduOnl_fd:9e:c4","Broadcast","ARP","60","Who has 10.0.0.8? Tell 10.0.0.4"
"454","48.811650","BaiduOnl_fd:9e:c4","Broadcast","ARP","60","Who has 10.0.0.9? Tell 10.0.0.4"
"455","48.811650","BaiduOnl_fd:9e:c4","Broadcast","ARP","60","Who has 10.0.0.10? Tell 10.0.0.4"
"456","48.812531","BaiduOnl_fd:9e:c4","Broadcast","ARP","60","Who has 10.0.0.11? Tell 10.0.0.4"
"457","49.391176","10.0.0.3","108.128.72.146","TLSv1.2","85","Application Data"
"458","49.610223","108.128.72.146","10.0.0.3","TLSv1.2","79","Application Data"
"459","49.657996","10.0.0.3","108.128.72.146","TCP","54","58530 → 443 [ACK] Seq=63 Ack=51 Win=1021 Len=0"
"460","49.800154","10.0.0.3","239.100.1.1","ICEP","401","Request(oneway): stateReceiver.receiveStationRunningState()"
"461","49.800280","10.0.0.3","239.100.1.1","ICEP","108","Request(oneway): stateReceiver.receiveAppRunningState()"
"462","49.808844","BaiduOnl_fd:9e:c4","Broadcast","ARP","60","Who has 10.0.0.12? Tell 10.0.0.4"
"463","49.809771","BaiduOnl_fd:9e:c4","Broadcast","ARP","60","Who has 10.0.0.2? Tell 10.0.0.4"
"464","49.810850","BaiduOnl_fd:9e:c4","Broadcast","ARP","60","Who has 10.0.0.5? Tell 10.0.0.4"
"465","49.811005","BaiduOnl_fd:9e:c4","Broadcast","ARP","60","Who has 10.0.0.6? Tell 10.0.0.4"
"466","49.813422","BaiduOnl_fd:9e:c4","Broadcast","ARP","60","Who has 10.0.0.7? Tell 10.0.0.4"
"467","49.813658","BaiduOnl_fd:9e:c4","Broadcast","ARP","60","Who has 10.0.0.8? Tell 10.0.0.4"
"468","49.814838","BaiduOnl_fd:9e:c4","Broadcast","ARP","60","Who has 10.0.0.9? Tell 10.0.0.4"
"469","49.814999","BaiduOnl_fd:9e:c4","Broadcast","ARP","60","Who has 10.0.0.10? Tell 10.0.0.4"
"470","49.815977","BaiduOnl_fd:9e:c4","Broadcast","ARP","60","Who has 10.0.0.11? Tell 10.0.0.4"
"471","49.884405","10.0.0.3","239.100.1.1","ICEP","355","Request(oneway): stateReceiver.receiveNetStatistics()"
"472","50.809994","BaiduOnl_fd:9e:c4","Broadcast","ARP","60","Who has 10.0.0.12? Tell 10.0.0.4"
"473","50.810875","BaiduOnl_fd:9e:c4","Broadcast","ARP","60","Who has 10.0.0.2? Tell 10.0.0.4"
"474","50.811938","BaiduOnl_fd:9e:c4","Broadcast","ARP","60","Who has 10.0.0.5? Tell 10.0.0.4"
"475","50.812093","BaiduOnl_fd:9e:c4","Broadcast","ARP","60","Who has 10.0.0.6? Tell 10.0.0.4"
"476","50.813315","BaiduOnl_fd:9e:c4","Broadcast","ARP","60","Who has 10.0.0.7? Tell 10.0.0.4"
"477","50.813368","BaiduOnl_fd:9e:c4","Broadcast","ARP","60","Who has 10.0.0.8? Tell 10.0.0.4"
"478","50.813451","BaiduOnl_fd:9e:c4","Broadcast","ARP","60","Who has 10.0.0.9? Tell 10.0.0.4"
"479","50.813651","BaiduOnl_fd:9e:c4","Broadcast","ARP","60","Who has 10.0.0.10? Tell 10.0.0.4"
"480","50.813842","BaiduOnl_fd:9e:c4","Broadcast","ARP","60","Who has 10.0.0.11? Tell 10.0.0.4"
"481","51.317392","10.0.0.3","10.0.0.1","ICMP","74","Echo (ping) request  id=0x0001, seq=1/256, ttl=128 (reply in 482)"
"482","51.317661","10.0.0.1","10.0.0.3","ICMP","74","Echo (ping) reply    id=0x0001, seq=1/256, ttl=64 (request in 481)"
"483","51.810970","BaiduOnl_fd:9e:c4","Broadcast","ARP","60","Who has 10.0.0.12? Tell 10.0.0.4"
"484","51.810970","BaiduOnl_fd:9e:c4","Broadcast","ARP","60","Who has 10.0.0.2? Tell 10.0.0.4"
"485","51.812137","BaiduOnl_fd:9e:c4","Broadcast","ARP","60","Who has 10.0.0.5? Tell 10.0.0.4"
"486","51.813454","BaiduOnl_fd:9e:c4","Broadcast","ARP","60","Who has 10.0.0.6? Tell 10.0.0.4"
"487","51.813454","BaiduOnl_fd:9e:c4","Broadcast","ARP","60","Who has 10.0.0.7? Tell 10.0.0.4"
"488","51.813645","BaiduOnl_fd:9e:c4","Broadcast","ARP","60","Who has 10.0.0.8? Tell 10.0.0.4"
"489","51.813817","BaiduOnl_fd:9e:c4","Broadcast","ARP","60","Who has 10.0.0.9? Tell 10.0.0.4"
"490","51.813854","BaiduOnl_fd:9e:c4","Broadcast","ARP","60","Who has 10.0.0.10? Tell 10.0.0.4"
"491","51.815370","BaiduOnl_fd:9e:c4","Broadcast","ARP","60","Who has 10.0.0.11? Tell 10.0.0.4"
"492","52.330186","10.0.0.3","10.0.0.1","ICMP","74","Echo (ping) request  id=0x0001, seq=2/512, ttl=128 (reply in 493)"
"493","52.330511","10.0.0.1","10.0.0.3","ICMP","74","Echo (ping) reply    id=0x0001, seq=2/512, ttl=64 (request in 492)"
"494","52.580208","10.0.0.3","104.17.24.14","TCP","55","[TCP Keep-Alive] 58906 → 443 [ACK] Seq=1 Ack=1 Win=1028 Len=1"
"495","52.778484","104.17.24.14","10.0.0.3","TCP","66","[TCP Keep-Alive ACK] 443 → 58906 [ACK] Seq=1 Ack=2 Win=64 Len=0 SLE=1 SRE=2"
"496","52.939447","Giga-Byt_01:fc:42","BaiduOnl_fd:9e:c4","ARP","42","Who has 10.0.0.4? Tell 10.0.0.3"
"497","52.941204","BaiduOnl_fd:9e:c4","Giga-Byt_01:fc:42","ARP","60","10.0.0.4 is at 88:2d:53:fd:9e:c4"
"498","53.276857","BaiduOnl_fd:9e:c4","Broadcast","ARP","60","Who has 10.0.0.1? Tell 10.0.0.4"
"499","53.345562","10.0.0.3","10.0.0.1","ICMP","74","Echo (ping) request  id=0x0001, seq=3/768, ttl=128 (reply in 500)"
"500","53.345766","10.0.0.1","10.0.0.3","ICMP","74","Echo (ping) reply    id=0x0001, seq=3/768, ttl=64 (request in 499)"
"501","54.361629","10.0.0.3","10.0.0.1","ICMP","74","Echo (ping) request  id=0x0001, seq=4/1024, ttl=128 (reply in 502)"
"502","54.361976","10.0.0.1","10.0.0.3","ICMP","74","Echo (ping) reply    id=0x0001, seq=4/1024, ttl=64 (request in 501)"
"503","55.003323","10.0.0.3","239.100.1.1","ICEP","401","Request(oneway): stateReceiver.receiveStationRunningState()"
"504","55.003468","10.0.0.3","239.100.1.1","ICEP","108","Request(oneway): stateReceiver.receiveAppRunningState()"
"505","55.064170","10.0.0.3","239.100.1.1","ICEP","355","Request(oneway): stateReceiver.receiveNetStatistics()"
"506","55.940426","10.0.0.3","52.139.250.253","TLSv1.2","98","Application Data"
"507","56.049159","52.139.250.253","10.0.0.3","TLSv1.2","229","Application Data"
"508","56.095805","10.0.0.3","52.139.250.253","TCP","54","55677 → 443 [ACK] Seq=89 Ack=351 Win=1029 Len=0"
"509","56.624561","10.0.0.3","10.0.0.1","ICMP","74","Echo (ping) request  id=0x0001, seq=5/1280, ttl=128 (reply in 510)"
"510","56.624825","10.0.0.1","10.0.0.3","ICMP","74","Echo (ping) reply    id=0x0001, seq=5/1280, ttl=64 (request in 509)"
"511","57.627265","10.0.0.3","10.0.0.1","ICMP","74","Echo (ping) request  id=0x0001, seq=6/1536, ttl=128 (reply in 512)"
"512","57.627581","10.0.0.1","10.0.0.3","ICMP","74","Echo (ping) reply    id=0x0001, seq=6/1536, ttl=64 (request in 511)"
"513","58.642866","10.0.0.3","10.0.0.1","ICMP","74","Echo (ping) request  id=0x0001, seq=7/1792, ttl=128 (reply in 514)"
"514","58.643163","10.0.0.1","10.0.0.3","ICMP","74","Echo (ping) reply    id=0x0001, seq=7/1792, ttl=64 (request in 513)"
"515","58.830131","10.0.0.3","172.67.193.35","TCP","55","[TCP Keep-Alive] 58901 → 443 [ACK] Seq=1 Ack=1 Win=1023 Len=1"
"516","59.037953","172.67.193.35","10.0.0.3","TCP","66","[TCP Keep-Alive ACK] 443 → 58901 [ACK] Seq=1 Ack=2 Win=66 Len=0 SLE=1 SRE=2"
"517","59.172593","10.0.0.4","239.255.255.250","SSDP","243","M-SEARCH * HTTP/1.1 "
"518","59.172953","10.0.0.1","10.0.0.255","TiVoConnect","208","Discovery Beacon R6400 (uuid:4d696e69-444c-164e-9d41-506a03bba742)"
"519","59.658233","10.0.0.3","10.0.0.1","ICMP","74","Echo (ping) request  id=0x0001, seq=8/2048, ttl=128 (reply in 520)"
"520","59.658519","10.0.0.1","10.0.0.3","ICMP","74","Echo (ping) reply    id=0x0001, seq=8/2048, ttl=64 (request in 519)"
"521","60.137074","10.0.0.3","239.100.1.1","ICEP","401","Request(oneway): stateReceiver.receiveStationRunningState()"
"522","60.137108","10.0.0.3","239.100.1.1","ICEP","108","Request(oneway): stateReceiver.receiveAppRunningState()"
"523","60.160208","10.0.0.3","239.100.1.1","ICEP","356","Request(oneway): stateReceiver.receiveNetStatistics()"
"524","61.341006","10.0.0.3","104.18.47.230","TCP","55","[TCP Keep-Alive] 58913 → 443 [ACK] Seq=1 Ack=1 Win=1023 Len=1"
"525","61.534657","104.18.47.230","10.0.0.3","TCP","66","[TCP Keep-Alive ACK] 443 → 58913 [ACK] Seq=1 Ack=2 Win=64 Len=0 SLE=1 SRE=2"
"526","62.274548","10.0.0.3","202.89.233.100","TCP","66","59072 → 443 [SYN] Seq=0 Win=64240 Len=0 MSS=1460 WS=256 SACK_PERM=1"
"527","62.316926","202.89.233.100","10.0.0.3","TCP","66","443 → 59072 [SYN, ACK] Seq=0 Ack=1 Win=65535 Len=0 MSS=1440 WS=256 SACK_PERM=1"
"528","62.316981","10.0.0.3","202.89.233.100","TCP","54","59072 → 443 [ACK] Seq=1 Ack=1 Win=263424 Len=0"
"529","62.317277","10.0.0.3","202.89.233.100","TLSv1.2","639","Client Hello"
"530","62.359517","202.89.233.100","10.0.0.3","TCP","60","443 → 59072 [ACK] Seq=1 Ack=586 Win=4194048 Len=0"
"531","62.359517","202.89.233.100","10.0.0.3","TLSv1.2","204","Server Hello, Change Cipher Spec, Encrypted Handshake Message"
"532","62.359774","10.0.0.3","202.89.233.100","TLSv1.2","105","Change Cipher Spec, Encrypted Handshake Message"
"533","62.359892","10.0.0.3","202.89.233.100","TLSv1.2","153","Application Data"
"534","62.360153","10.0.0.3","202.89.233.100","TLSv1.2","2133","Application Data"
"535","62.360198","10.0.0.3","202.89.233.100","TLSv1.2","286","Application Data"
"536","62.401857","202.89.233.100","10.0.0.3","TCP","60","443 → 59072 [ACK] Seq=151 Ack=637 Win=4194048 Len=0"
"537","62.401857","202.89.233.100","10.0.0.3","TCP","60","443 → 59072 [ACK] Seq=151 Ack=736 Win=4194048 Len=0"
"538","62.401963","202.89.233.100","10.0.0.3","TLSv1.2","123","Application Data"
"539","62.402123","10.0.0.3","202.89.233.100","TLSv1.2","92","Application Data"
"540","62.402140","202.89.233.100","10.0.0.3","TLSv1.2","92","Application Data"
"541","62.402326","202.89.233.100","10.0.0.3","TCP","60","443 → 59072 [ACK] Seq=258 Ack=3047 Win=4193792 Len=0"
"542","62.442200","10.0.0.3","202.89.233.100","TCP","54","59072 → 443 [ACK] Seq=3085 Ack=258 Win=263168 Len=0"
"543","62.444083","202.89.233.100","10.0.0.3","TCP","60","443 → 59072 [ACK] Seq=258 Ack=3085 Win=4193792 Len=0"
"544","62.484239","202.89.233.100","10.0.0.3","TLSv1.2","495","Application Data, Application Data"
"545","62.488893","10.0.0.3","23.53.40.192","TCP","54","57433 → 443 [RST, ACK] Seq=2 Ack=1 Win=0 Len=0"
"546","62.535306","10.0.0.3","202.89.233.100","TCP","54","59072 → 443 [ACK] Seq=3085 Ack=699 Win=262656 Len=0"
"547","62.997671","10.0.0.3","202.89.233.100","TLSv1.2","209","Application Data"
"548","62.997701","10.0.0.3","202.89.233.100","TLSv1.2","919","Application Data"
"549","63.039712","202.89.233.100","10.0.0.3","TCP","60","443 → 59072 [ACK] Seq=699 Ack=3240 Win=4193536 Len=0"
"550","63.039795","202.89.233.100","10.0.0.3","TCP","60","443 → 59072 [ACK] Seq=699 Ack=4105 Win=4194816 Len=0"
"551","63.099283","202.89.233.100","10.0.0.3","TLSv1.2","199","Application Data"
"552","63.144959","10.0.0.3","202.89.233.100","TCP","54","59072 → 443 [ACK] Seq=4105 Ack=844 Win=262656 Len=0"
"553","63.176563","10.0.0.3","202.89.233.100","TLSv1.2","2020","Application Data"
"554","63.218671","202.89.233.100","10.0.0.3","TCP","60","443 → 59072 [ACK] Seq=844 Ack=6071 Win=4194816 Len=0"
"555","63.434979","202.89.233.100","10.0.0.3","TCP","1506","443 → 59072 [ACK] Seq=844 Ack=6071 Win=4194816 Len=1452 [TCP segment of a reassembled PDU]"
"556","63.435146","202.89.233.100","10.0.0.3","TCP","1506","443 → 59072 [ACK] Seq=2296 Ack=6071 Win=4194816 Len=1452 [TCP segment of a reassembled PDU]"
"557","63.435146","202.89.233.100","10.0.0.3","TLSv1.2","518","Application Data"
"558","63.435146","202.89.233.100","10.0.0.3","TLSv1.2","147","Application Data"
"559","63.435146","202.89.233.100","10.0.0.3","TCP","1506","443 → 59072 [ACK] Seq=4305 Ack=6071 Win=4194816 Len=1452 [TCP segment of a reassembled PDU]"
"560","63.435146","202.89.233.100","10.0.0.3","TCP","1506","443 → 59072 [ACK] Seq=5757 Ack=6071 Win=4194816 Len=1452 [TCP segment of a reassembled PDU]"
"561","63.435146","202.89.233.100","10.0.0.3","TLSv1.2","1284","Application Data"
"562","63.435230","10.0.0.3","202.89.233.100","TCP","54","59072 → 443 [ACK] Seq=6071 Ack=8439 Win=263424 Len=0"
"563","63.435257","202.89.233.100","10.0.0.3","TCP","1506","443 → 59072 [ACK] Seq=8439 Ack=6071 Win=4194816 Len=1452 [TCP segment of a reassembled PDU]"
"564","63.435257","202.89.233.100","10.0.0.3","TCP","1506","443 → 59072 [ACK] Seq=9891 Ack=6071 Win=4194816 Len=1452 [TCP segment of a reassembled PDU]"
"565","63.435257","202.89.233.100","10.0.0.3","TLSv1.2","1284","Application Data"
"566","63.435257","202.89.233.100","10.0.0.3","TCP","1506","443 → 59072 [ACK] Seq=12573 Ack=6071 Win=4194816 Len=1452 [TCP segment of a reassembled PDU]"
"567","63.435257","202.89.233.100","10.0.0.3","TCP","1506","443 → 59072 [ACK] Seq=14025 Ack=6071 Win=4194816 Len=1452 [TCP segment of a reassembled PDU]"
"568","63.435257","202.89.233.100","10.0.0.3","TLSv1.2","1284","Application Data"
"569","63.435327","10.0.0.3","202.89.233.100","TCP","54","59072 → 443 [ACK] Seq=6071 Ack=16707 Win=263424 Len=0"
"570","63.435343","202.89.233.100","10.0.0.3","TCP","1506","443 → 59072 [ACK] Seq=16707 Ack=6071 Win=4194816 Len=1452 [TCP segment of a reassembled PDU]"
"571","63.435343","202.89.233.100","10.0.0.3","TCP","1506","443 → 59072 [ACK] Seq=18159 Ack=6071 Win=4194816 Len=1452 [TCP segment of a reassembled PDU]"
"572","63.435343","202.89.233.100","10.0.0.3","TLSv1.2","1284","Application Data"
"573","63.435343","202.89.233.100","10.0.0.3","TCP","1506","443 → 59072 [ACK] Seq=20841 Ack=6071 Win=4194816 Len=1452 [TCP segment of a reassembled PDU]"
"574","63.435389","10.0.0.3","202.89.233.100","TCP","54","59072 → 443 [ACK] Seq=6071 Ack=22293 Win=263424 Len=0"
"575","63.435401","202.89.233.100","10.0.0.3","TCP","1506","443 → 59072 [ACK] Seq=22293 Ack=6071 Win=4194816 Len=1452 [TCP segment of a reassembled PDU]"